<!ELEMENT disciplinas (disciplina+)>
<!ELEMENT disciplina (id, codigo, nome, carga, ementa, semestre)>
<!ELEMENT id (#PCDATA)>
<!ELEMENT codigo (#PCDATA)>
<!ELEMENT nome (#PCDATA)>
<!ELEMENT carga (#PCDATA)>
<!ELEMENT ementa (#PCDATA)>
<!ELEMENT semestre (#PCDATA)>
